<!ELEMENT HR (DIRECCIONES_REGIONES*)>
<!ELEMENT DIRECCIONES_REGIONES (REGION*, PAIS*, CIUDAD*, DIRECCION*)>
<!ELEMENT REGION (#PCDATA)>
<!ELEMENT PAIS (#PCDATA)>
<!ELEMENT CIUDAD (#PCDATA)>
<!ELEMENT DIRECCION (#PCDATA)>
<!ATTLIST REGION id CDATA #REQUIRED>